{
  "system_id": "spider_web",
  "family": "spider",
  "required_cushions": 3,
  "track_model": "route_track",
  "canonical_track": "RLTR_R",
  "entry_rail": "RIGHT",
  "exit_rail": "RIGHT",
  "allowed_tracks": [
    "RLTR_R",
    "LRTL_L",
    "RLBR_L",
    "LRBL_R"
  ],
  "difficulty": 3,
  "notes": "Route tracks (CO-C1-C2-C3 rails + spin suffix). Not FamilyTrack values; single-track save only. SSOT: 작업관리/SPIDER_WEB_SYSTEM_SSOT.md"
}
